{
  "v": 2,
  "id": "01JB2Z8Y3K4M5N6P7Q8R9S0TVW",
  "type": "player.link.completed",
  "ts": 1761274800000,
  "replyTo": "01JB2Z8Y3K4M5N6P7Q8R9S0TVX",
  "payload": {
    "proof": "web_registration",
    "player": {
      "uuid": "069a79f4-44e9-4726-a5be-fca90e38aaf5",
      "name": "Steve"
    },
    "webUsername": "steve_web",
    "provisionGameAccount": true
  }
}
